{
  "format": "jellyframe.device-image",
  "formatVersion": 0,
  "imageId": "org.jellyframe.ws147.developer",
  "imageVersion": "0.1.0-dev",
  "runtimeVersion": "0.6.0-dev",
  "renderCore": {
    "version": "0.6.0",
    "abi": 1
  },
  "source": {
    "revision": "fbf10784ac8ce38f41ced40fa013a43564c992c8",
    "firmwareSha256": "e7eb9b16cce5d9e781fc93717826192781b652704e91d1859f353f74e5cfaacc"
  },
  "board": {
    "id": "ws147",
    "display": {
      "width": 172,
      "height": 320,
      "shape": "rect"
    }
  },
  "profile": {
    "id": "rect-172x320",
    "featureFamilies": [
      "core.document",
      "core.paint",
      "forms.advanced",
      "css.flex-grid",
      "css.modern-paint",
      "graphics.canvas2d"
    ]
  },
  "transport": {
    "protocol": "JFDP/1",
    "kind": "usb-serial-jtag"
  },
  "storage": {
    "maxBundleBytes": 327680
  },
  "recovery": {
    "procedureId": "ws147-usb-recovery-v1",
    "factoryImageSha256": "6f3360753422c60ba32a1cee92fd01575e64ae41433acc31b9fb35d527bad2e1"
  }
}
